{
  "$schema": "https://json-schema.org/draft/2020-12/schema",
  "$id": "https://github.com/jang1563/agentic-drug-discovery-system/rl_env/specs/clinical_outcome_pattern_mixture_influence_summary.schema.json",
  "title": "Clinical Outcome Pattern-Mixture Influence Calibration Summary",
  "description": "Compact human- and machine-readable unequal-cluster interval calibration summary.",
  "type": "object",
  "additionalProperties": false,
  "required": [
    "schema_version",
    "protocol_id",
    "protocol_fingerprint",
    "report_fingerprint",
    "stress_protocol_id",
    "stress_protocol_fingerprint",
    "stress_report_fingerprint",
    "pattern_mixture_protocol_id",
    "pattern_mixture_protocol_fingerprint",
    "pattern_mixture_report_fingerprint",
    "method_id",
    "methods",
    "replicates",
    "log_imor_grid",
    "primary_metric",
    "targets",
    "all_production_eligible_scenarios_research_targets_met",
    "all_dominant_cluster_hard_stops_preserved",
    "scenarios",
    "claim_boundary"
  ],
  "properties": {
    "schema_version": {
      "const": "adds.clinical-outcome-pattern-mixture-influence-calibration-summary.v1"
    },
    "protocol_id": {"type": "string", "minLength": 1},
    "protocol_fingerprint": {"$ref": "#/$defs/sha256"},
    "report_fingerprint": {"$ref": "#/$defs/sha256"},
    "stress_protocol_id": {"type": "string", "minLength": 1},
    "stress_protocol_fingerprint": {"$ref": "#/$defs/sha256"},
    "stress_report_fingerprint": {"$ref": "#/$defs/sha256"},
    "pattern_mixture_protocol_id": {"type": "string", "minLength": 1},
    "pattern_mixture_protocol_fingerprint": {"$ref": "#/$defs/sha256"},
    "pattern_mixture_report_fingerprint": {"$ref": "#/$defs/sha256"},
    "method_id": {
      "const": "adds.pattern-mixture.unequal-cluster-influence-calibration.v1"
    },
    "methods": {"$ref": "#/$defs/methodOrder"},
    "replicates": {"type": "integer", "minimum": 1},
    "log_imor_grid": {
      "type": "array",
      "items": {"type": "number"},
      "minItems": 1,
      "uniqueItems": true
    },
    "primary_metric": {"$ref": "#/$defs/metric"},
    "targets": {"$ref": "#/$defs/targets"},
    "all_production_eligible_scenarios_research_targets_met": {"type": "boolean"},
    "all_dominant_cluster_hard_stops_preserved": {"type": "boolean"},
    "scenarios": {
      "type": "array",
      "items": {"$ref": "#/$defs/scenario"},
      "minItems": 1
    },
    "claim_boundary": {"$ref": "#/$defs/claimBoundary"}
  },
  "$defs": {
    "sha256": {"type": "string", "pattern": "^[0-9a-f]{64}$"},
    "nullableNumber": {"type": ["number", "null"]},
    "nullableProbability": {
      "type": ["number", "null"],
      "minimum": 0.0,
      "maximum": 1.0
    },
    "metric": {
      "enum": [
        "observed_favorable_rate",
        "policy_a_brier_score",
        "policy_b_brier_score",
        "policy_a_calibration_in_the_large",
        "policy_b_calibration_in_the_large",
        "policy_a_classification_accuracy",
        "policy_b_classification_accuracy",
        "brier_difference_b_minus_a"
      ]
    },
    "method": {
      "enum": [
        "delete_one_normal",
        "delete_one_student_t",
        "delete_mj_student_t",
        "delete_mj_webb_multiplier"
      ]
    },
    "methodOrder": {
      "const": [
        "delete_one_normal",
        "delete_one_student_t",
        "delete_mj_student_t",
        "delete_mj_webb_multiplier"
      ]
    },
    "rate": {
      "type": "object",
      "additionalProperties": false,
      "required": ["event_count", "total_count", "rate", "lower", "upper"],
      "properties": {
        "event_count": {"type": "integer", "minimum": 0},
        "total_count": {"type": "integer", "minimum": 0},
        "rate": {"$ref": "#/$defs/nullableProbability"},
        "lower": {"$ref": "#/$defs/nullableProbability"},
        "upper": {"$ref": "#/$defs/nullableProbability"}
      }
    },
    "ratioRange": {
      "type": "object",
      "additionalProperties": false,
      "required": ["minimum", "maximum"],
      "properties": {
        "minimum": {"type": ["number", "null"], "minimum": 0.0},
        "maximum": {"type": ["number", "null"], "minimum": 0.0}
      }
    },
    "primaryCell": {
      "type": "object",
      "additionalProperties": false,
      "required": [
        "log_imor",
        "mean_estimate",
        "mean_minus_prior_pattern_mixture",
        "interval_yield",
        "model_functional_coverage",
        "standard_error_to_empirical_sd_ratio",
        "calibration_target_met"
      ],
      "properties": {
        "log_imor": {"type": "number"},
        "mean_estimate": {"$ref": "#/$defs/nullableNumber"},
        "mean_minus_prior_pattern_mixture": {"$ref": "#/$defs/nullableNumber"},
        "interval_yield": {"$ref": "#/$defs/rate"},
        "model_functional_coverage": {"$ref": "#/$defs/rate"},
        "standard_error_to_empirical_sd_ratio": {
          "type": ["number", "null"],
          "minimum": 0.0
        },
        "calibration_target_met": {"type": "boolean"}
      }
    },
    "methodResult": {
      "type": "object",
      "additionalProperties": false,
      "required": [
        "method",
        "operational_candidate",
        "experimental_only",
        "minimum_coverage_lower",
        "minimum_interval_yield_lower",
        "standard_error_calibration_ratio_range",
        "all_metric_calibration_targets_met",
        "primary_metric_grid"
      ],
      "properties": {
        "method": {"$ref": "#/$defs/method"},
        "operational_candidate": {"type": "boolean"},
        "experimental_only": {"type": "boolean"},
        "minimum_coverage_lower": {"$ref": "#/$defs/nullableProbability"},
        "minimum_interval_yield_lower": {"$ref": "#/$defs/nullableProbability"},
        "standard_error_calibration_ratio_range": {"$ref": "#/$defs/ratioRange"},
        "all_metric_calibration_targets_met": {"type": "boolean"},
        "primary_metric_grid": {
          "type": "array",
          "items": {"$ref": "#/$defs/primaryCell"},
          "minItems": 1
        }
      }
    },
    "scenario": {
      "type": "object",
      "additionalProperties": false,
      "required": [
        "scenario_id",
        "stage",
        "endpoint_family",
        "analysis_cluster_count",
        "minimum_cluster_size",
        "maximum_cluster_size",
        "maximum_cluster_unit_fraction",
        "equal_cluster_sizes",
        "production_eligible",
        "production_ineligibility_reasons",
        "methods",
        "student_t_coverage_noninferior_to_normal_all_cells",
        "equal_size_delete_mj_standard_error_equivalence_expected",
        "equal_size_delete_mj_standard_error_equivalence_met",
        "student_t_candidate_target_met",
        "delete_mj_sensitivity_target_met",
        "webb_experimental_target_met",
        "dominant_cluster_hard_stop_preserved",
        "research_target_met"
      ],
      "properties": {
        "scenario_id": {"type": "string", "minLength": 1},
        "stage": {"const": "clinical_strategy"},
        "endpoint_family": {"type": "string", "minLength": 1},
        "analysis_cluster_count": {"type": "integer", "minimum": 1},
        "minimum_cluster_size": {"type": "integer", "minimum": 1},
        "maximum_cluster_size": {"type": "integer", "minimum": 1},
        "maximum_cluster_unit_fraction": {
          "type": "number",
          "exclusiveMinimum": 0.0,
          "maximum": 1.0
        },
        "equal_cluster_sizes": {"type": "boolean"},
        "production_eligible": {"type": "boolean"},
        "production_ineligibility_reasons": {
          "type": "array",
          "items": {"enum": ["insufficient_clusters", "dominant_cluster"]},
          "maxItems": 2,
          "uniqueItems": true
        },
        "methods": {
          "type": "array",
          "items": {"$ref": "#/$defs/methodResult"},
          "minItems": 4,
          "maxItems": 4
        },
        "student_t_coverage_noninferior_to_normal_all_cells": {"type": "boolean"},
        "equal_size_delete_mj_standard_error_equivalence_expected": {"type": "boolean"},
        "equal_size_delete_mj_standard_error_equivalence_met": {"type": "boolean"},
        "student_t_candidate_target_met": {"type": "boolean"},
        "delete_mj_sensitivity_target_met": {"type": "boolean"},
        "webb_experimental_target_met": {"type": "boolean"},
        "dominant_cluster_hard_stop_preserved": {"type": "boolean"},
        "research_target_met": {"type": "boolean"}
      }
    },
    "targets": {
      "type": "object",
      "additionalProperties": false,
      "required": [
        "confidence_level",
        "coverage_target",
        "minimum_interval_yield",
        "minimum_production_clusters",
        "maximum_production_cluster_unit_fraction",
        "maximum_absolute_bias",
        "standard_error_calibration_lower",
        "standard_error_calibration_upper"
      ],
      "properties": {
        "confidence_level": {"type": "number", "exclusiveMinimum": 0.5, "exclusiveMaximum": 1.0},
        "coverage_target": {"type": "number", "minimum": 0.0, "maximum": 1.0},
        "minimum_interval_yield": {"type": "number", "minimum": 0.0, "maximum": 1.0},
        "minimum_production_clusters": {"type": "integer", "minimum": 3},
        "maximum_production_cluster_unit_fraction": {"type": "number", "minimum": 0.0, "maximum": 1.0},
        "maximum_absolute_bias": {"type": "number", "minimum": 0.0},
        "standard_error_calibration_lower": {"type": "number", "minimum": 0.0},
        "standard_error_calibration_upper": {"type": "number", "minimum": 0.0}
      }
    },
    "claimBoundary": {
      "type": "object",
      "additionalProperties": false,
      "required": [
        "aggregate_simulation_only",
        "replicate_level_records_included",
        "cluster_level_records_included",
        "unit_level_records_included",
        "real_clinical_outcomes_included",
        "stress_only_ineligible_intervals_operational",
        "dominant_cluster_override_allowed",
        "automatic_method_selection_included",
        "regression_wild_cluster_bootstrap_claimed",
        "multiplier_method_experimental_only",
        "identification_and_sampling_uncertainty_separated"
      ],
      "properties": {
        "aggregate_simulation_only": {"const": true},
        "replicate_level_records_included": {"const": false},
        "cluster_level_records_included": {"const": false},
        "unit_level_records_included": {"const": false},
        "real_clinical_outcomes_included": {"const": false},
        "stress_only_ineligible_intervals_operational": {"const": false},
        "dominant_cluster_override_allowed": {"const": false},
        "automatic_method_selection_included": {"const": false},
        "regression_wild_cluster_bootstrap_claimed": {"const": false},
        "multiplier_method_experimental_only": {"const": true},
        "identification_and_sampling_uncertainty_separated": {"const": true}
      }
    }
  }
}
