{
  "all_dominant_cluster_hard_stops_preserved": true,
  "all_production_eligible_scenarios_research_targets_met": true,
  "claim_boundary": {
    "aggregate_simulation_only": true,
    "automatic_method_selection_included": false,
    "cluster_level_records_included": false,
    "dominant_cluster_override_allowed": false,
    "identification_and_sampling_uncertainty_separated": true,
    "multiplier_method_experimental_only": true,
    "real_clinical_outcomes_included": false,
    "regression_wild_cluster_bootstrap_claimed": false,
    "replicate_level_records_included": false,
    "stress_only_ineligible_intervals_operational": false,
    "unit_level_records_included": false
  },
  "log_imor_grid": [
    -2.0,
    -1.0,
    0.0,
    1.0,
    2.0
  ],
  "method_id": "adds.pattern-mixture.unequal-cluster-influence-calibration.v1",
  "methods": [
    "delete_one_normal",
    "delete_one_student_t",
    "delete_mj_student_t",
    "delete_mj_webb_multiplier"
  ],
  "pattern_mixture_protocol_fingerprint": "c638c88456d065ae26562516a25317591573a0aba892cc36d2b8283890b591d0",
  "pattern_mixture_protocol_id": "synthetic-unequal-cluster-pattern-mixture",
  "pattern_mixture_report_fingerprint": "5321f2dc596c1d9b29200adb4610ac6a69870c440da8bf883ca18dfbe7fe39ed",
  "primary_metric": "observed_favorable_rate",
  "protocol_fingerprint": "a57300753f0467f7589aa54c86f94bd7c25448ed37e92abba6c757af61376694",
  "protocol_id": "synthetic-unequal-cluster-influence-calibration",
  "replicates": 500,
  "report_fingerprint": "80ab9f4ae9dc2c0953bc302151a3846e9dce414a529b7911ad34fe3cd971abc9",
  "scenarios": [
    {
      "analysis_cluster_count": 8,
      "delete_mj_sensitivity_target_met": true,
      "dominant_cluster_hard_stop_preserved": true,
      "endpoint_family": "composite_benefit_risk",
      "equal_cluster_sizes": true,
      "equal_size_delete_mj_standard_error_equivalence_expected": true,
      "equal_size_delete_mj_standard_error_equivalence_met": true,
      "maximum_cluster_size": 16,
      "maximum_cluster_unit_fraction": 0.125,
      "methods": [
        {
          "all_metric_calibration_targets_met": true,
          "experimental_only": false,
          "method": "delete_one_normal",
          "minimum_coverage_lower": 0.872793949134,
          "minimum_interval_yield_lower": 0.992375659538,
          "operational_candidate": false,
          "primary_metric_grid": [
            {
              "calibration_target_met": true,
              "interval_yield": {
                "event_count": 500,
                "lower": 0.992375659538,
                "rate": 1.0,
                "total_count": 500,
                "upper": 1.0
              },
              "log_imor": -2.0,
              "mean_estimate": 0.423948246904,
              "mean_minus_prior_pattern_mixture": 0.0,
              "model_functional_coverage": {
                "event_count": 454,
                "lower": 0.879461261864,
                "rate": 0.908,
                "total_count": 500,
                "upper": 0.93031727632
              },
              "standard_error_to_empirical_sd_ratio": 0.97559982654
            },
            {
              "calibration_target_met": true,
              "interval_yield": {
                "event_count": 500,
                "lower": 0.992375659538,
                "rate": 1.0,
                "total_count": 500,
                "upper": 1.0
              },
              "log_imor": -1.0,
              "mean_estimate": 0.473383077041,
              "mean_minus_prior_pattern_mixture": 0.0,
              "model_functional_coverage": {
                "event_count": 451,
                "lower": 0.872793949134,
                "rate": 0.902,
                "total_count": 500,
                "upper": 0.925076081135
              },
              "standard_error_to_empirical_sd_ratio": 0.981543866588
            },
            {
              "calibration_target_met": true,
              "interval_yield": {
                "event_count": 500,
                "lower": 0.992375659538,
                "rate": 1.0,
                "total_count": 500,
                "upper": 1.0
              },
              "log_imor": 0.0,
              "mean_estimate": 0.541697480548,
              "mean_minus_prior_pattern_mixture": 0.0,
              "model_functional_coverage": {
                "event_count": 451,
                "lower": 0.872793949134,
                "rate": 0.902,
                "total_count": 500,
                "upper": 0.925076081135
              },
              "standard_error_to_empirical_sd_ratio": 0.988891980375
            },
            {
              "calibration_target_met": true,
              "interval_yield": {
                "event_count": 500,
                "lower": 0.992375659538,
                "rate": 1.0,
                "total_count": 500,
                "upper": 1.0
              },
              "log_imor": 1.0,
              "mean_estimate": 0.605850106678,
              "mean_minus_prior_pattern_mixture": 0.0,
              "model_functional_coverage": {
                "event_count": 452,
                "lower": 0.875013037572,
                "rate": 0.904,
                "total_count": 500,
                "upper": 0.926826495335
              },
              "standard_error_to_empirical_sd_ratio": 0.997149455389
            },
            {
              "calibration_target_met": true,
              "interval_yield": {
                "event_count": 500,
                "lower": 0.992375659538,
                "rate": 1.0,
                "total_count": 500,
                "upper": 1.0
              },
              "log_imor": 2.0,
              "mean_estimate": 0.647396907018,
              "mean_minus_prior_pattern_mixture": 0.0,
              "model_functional_coverage": {
                "event_count": 454,
                "lower": 0.879461261864,
                "rate": 0.908,
                "total_count": 500,
                "upper": 0.93031727632
              },
              "standard_error_to_empirical_sd_ratio": 0.999741037932
            }
          ],
          "standard_error_calibration_ratio_range": {
            "maximum": 1.081646865287,
            "minimum": 0.97559982654
          }
        },
        {
          "all_metric_calibration_targets_met": true,
          "experimental_only": false,
          "method": "delete_one_student_t",
          "minimum_coverage_lower": 0.901931595983,
          "minimum_interval_yield_lower": 0.992375659538,
          "operational_candidate": true,
          "primary_metric_grid": [
            {
              "calibration_target_met": true,
              "interval_yield": {
                "event_count": 500,
                "lower": 0.992375659538,
                "rate": 1.0,
                "total_count": 500,
                "upper": 1.0
              },
              "log_imor": -2.0,
              "mean_estimate": 0.423948246904,
              "mean_minus_prior_pattern_mixture": 0.0,
              "model_functional_coverage": {
                "event_count": 473,
                "lower": 0.922573438489,
                "rate": 0.946,
                "total_count": 500,
                "upper": 0.962625649819
              },
              "standard_error_to_empirical_sd_ratio": 0.97559982654
            },
            {
              "calibration_target_met": true,
              "interval_yield": {
                "event_count": 500,
                "lower": 0.992375659538,
                "rate": 1.0,
                "total_count": 500,
                "upper": 1.0
              },
              "log_imor": -1.0,
              "mean_estimate": 0.473383077041,
              "mean_minus_prior_pattern_mixture": 0.0,
              "model_functional_coverage": {
                "event_count": 470,
                "lower": 0.915638936875,
                "rate": 0.94,
                "total_count": 500,
                "upper": 0.957651643519
              },
              "standard_error_to_empirical_sd_ratio": 0.981543866588
            },
            {
              "calibration_target_met": true,
              "interval_yield": {
                "event_count": 500,
                "lower": 0.992375659538,
                "rate": 1.0,
                "total_count": 500,
                "upper": 1.0
              },
              "log_imor": 0.0,
              "mean_estimate": 0.541697480548,
              "mean_minus_prior_pattern_mixture": 0.0,
              "model_functional_coverage": {
                "event_count": 471,
                "lower": 0.917943812144,
                "rate": 0.942,
                "total_count": 500,
                "upper": 0.959316270888
              },
              "standard_error_to_empirical_sd_ratio": 0.988891980375
            },
            {
              "calibration_target_met": true,
              "interval_yield": {
                "event_count": 500,
                "lower": 0.992375659538,
                "rate": 1.0,
                "total_count": 500,
                "upper": 1.0
              },
              "log_imor": 1.0,
              "mean_estimate": 0.605850106678,
              "mean_minus_prior_pattern_mixture": 0.0,
              "model_functional_coverage": {
                "event_count": 470,
                "lower": 0.915638936875,
                "rate": 0.94,
                "total_count": 500,
                "upper": 0.957651643519
              },
              "standard_error_to_empirical_sd_ratio": 0.997149455389
            },
            {
              "calibration_target_met": true,
              "interval_yield": {
                "event_count": 500,
                "lower": 0.992375659538,
                "rate": 1.0,
                "total_count": 500,
                "upper": 1.0
              },
              "log_imor": 2.0,
              "mean_estimate": 0.647396907018,